445,용서받지 못한 자,클린트의 카리스마를 기대하고 본 나로선 실망할 수밖에 없었다,5
446,용서받지 못한 자,괜찮은 웨스턴 무비. 배우들이 모든 걸 살린다.,5
447,용서받지 못한 자,클린트이스트우드는 색깔이 확실해서 좋음 이 영화는 지루한건 사실이지만,6
448,용서받지 못한 자,내가 본 서부영화 중에는 최고...,10
449,용서받지 못한 자,여러번 봐도 마지막 술집장면은 명장면,10
450,용서받지 못한 자,정말 소름끼치는 명작이다!!!,10
451,용서받지 못한 자,클린트이스트우드의 인생최고의 명작 여기선 폭력으로결말을맺지만후에 용서받지못한자 시즌2그랜토리노로 폭력으로부터 용서받게된다.,10
452,용서받지 못한 자,난 이런 영화 싫다 짜증난다.,1
453,용서받지 못한 자,늙은 총잡이가 애송이에게: 전설적인 건파이팅 그건 허구, 현실은 무방비로 화장실에 앉은 놈도..그리고 싸구려 위스키 지참요. 황혼의 진홍빛이 짙어지면 걷어야하는 빨래처럼 살아남은 자들도 그렇게 가는 것을...,9
454,용서받지 못한 자,클린트 이스트우드 영화의 최고봉. 이영화로 그는 정점을 찍었다.,10
455,용서받지 못한 자,너무 솔직해서 그런가? 지루하고 식상하고 재미없다.,1
456,용서받지 못한 자,리차드 해리스는 왜 나왔는지 모르겠고 후반은 그냥 만화같은 먼치킨 액션,7
457,용서받지 못한 자,이 영화를 보고 있는 우리네 역시 '용서받지 못한 자'이다.,9
458,용서받지 못한 자,서부는 죽었고, 보수는 살아있다.는 건가,6
459,용서받지 못한 자,서부영화지만 그닥 공감이나 감동은 없다..클린트이스트우드 연출이라고 무조건 후함은 없지.,7
460,용서받지 못한 자,알파치노랑이스트우드의늙어힘빠진듯한연기는짜증그자체다 지루!,1
461,용서받지 못한 자,왜 이제는 이런 영화를 만들지 못하는가,10
462,용서받지 못한 자,표적이 잘 안맞던 실력이 술을 마시니 다시 옛 기량이 나오네. 애들이 고아가 될 수도 있는데 50 달러를 벌러 사냥을 가다니 덜덜 그나저나 네드와 꼬마는 공짜로 OO들과 많이 해서 좋았겠다.,7
463,용서받지 못한 자,내눈이 썩은건가...............나만딴영화본건가 뭐지...,4
464,용서받지 못한 자,최고로 지루한 서부영화. 평점 1점주긴 또 처음이네,1
465,용서받지 못한 자,무법자로서의 살인, 현상금을 위한 살인, 복수를 위한 살인 서로 쫌 다르나? 용서받지도 못했고 용서받을 생각도 없는 듯 ㅋ. 작품상, 감독상...글쎄요,6
466,용서받지 못한 자,주인공을 제외 하고는 눈뜬 장님들,7
467,용서받지 못한 자,호평이 많아서 기대했는데, 그만큼은 아니군요... 마지막에 멋지긴 했지만 과정에 불만이 좀 있습니다 ㅎ 참고로 총싸움은 거의 없네요.,7
468,용서받지 못한 자,처음부터 끝까지 잔잔하다 심지어 싸울때도,4
469,용서받지 못한 자,지루하고 빈약한 작품...;;;,6
470,용서받지 못한 자,이영화는 줄거리가 다입니다. 그냥 레전드가 레전드되는건데 뭘 죄를 다받어 다 죽이고 지혼자 사는데,1
471,용서받지 못한 자,나쁘진 않지만 확실히 고전영화긴 하다...,6
472,용서받지 못한 자,기대한 것 보다 많이 루즈하다,1
473,용서받지 못한 자,이 영화는 주인공의 성찰만 있을 뿐 깨달음이 없어서인지 설득력을 잃었다.,5
474,용서받지 못한 자,아무리 이스트우드지만 9점대까진 아님,1
475,용서받지 못한 자,뭔 서부영화가 이따구야...,2
476,용서받지 못한 자,많이 지루한데 왜이리 평점이 높은건지;;,5
477,용서받지 못한 자,와 개 OOO 줬같이 지루하네 OOO,2
478,용서받지 못한 자,도저히 너무 지루해서 못 봐주겠다,1
